{"active_ci":true,"clean_checkout":true,"compiler":{"compatibility_sha256":"bbbbbbbbbbbbbbbbbbbbbbbbbbbbbbbbbbbbbbbbbbbbbbbbbbbbbbbbbbbbbbbb","path":"bootstrap/stage1_frozen","pinned":true,"sha256":"aaaaaaaaaaaaaaaaaaaaaaaaaaaaaaaaaaaaaaaaaaaaaaaaaaaaaaaaaaaaaaaa"},"disabled_workflow_count":0,"limits":{"jobs":1,"memory_max_bytes":8589934592,"memory_swap_max_bytes":0,"opt_jobs":1,"pids_max":25,"timeout_seconds":1800},"platforms":[{"name":"linux-x86_64","support":"required"},{"name":"linux-arm64","support":"static-policy"},{"name":"macos","support":"unsupported-fail-closed"},{"name":"windows","support":"unsupported-fail-closed"}],"repair_allowed":false,"schema":"seen-gate0-certification-v1","source_commit":"1111111111111111111111111111111111111111","steps":[{"artifact_sha256":"cccccccccccccccccccccccccccccccccccccccccccccccccccccccccccccccc","name":"build","status":"passed"},{"artifact_sha256":"dddddddddddddddddddddddddddddddddddddddddddddddddddddddddddddddd","name":"test","status":"passed"},{"artifact_sha256":"eeeeeeeeeeeeeeeeeeeeeeeeeeeeeeeeeeeeeeeeeeeeeeeeeeeeeeeeeeeeeeee","name":"fuzz-smoke","status":"passed"},{"artifact_sha256":"ffffffffffffffffffffffffffffffffffffffffffffffffffffffffffffffff","name":"package","status":"passed"}],"target":"linux-x86_64"}
